<?xml version="1.0" encoding="UTF-8" standalone="no"?><list xmlns:xsi="http://www.w3.org/2001/XMLSchema-instance" xsi:noNamespaceSchemaLocation="../../../../xsd/locationSpawnlist.xsd">
	<spawns name="16_19">
		
		<npc id="32133">
			<spawn heading="0" x="-125872" y="38208" z="1232"/>
		</npc>
		
		<npc id="32134">
			<spawn heading="0" x="-125872" y="38016" z="1232"/>
		</npc>
		
		<npc id="32136">
			<spawn heading="0" x="-122400" y="38432" z="1440"/>
		</npc>
		
		<npc id="32137">
			<spawn heading="0" x="-122396" y="37784" z="1432"/>
		</npc>
		
		<npc id="32179">
			<spawn heading="63440" x="-110544" y="49040" z="-1128"/>
		</npc>
		
		<npc id="32180">
			<spawn heading="3072" x="-110536" y="45162" z="-1128"/>
		</npc>
		
		<npc id="32191">
			<spawn heading="8172" x="-124624" y="51584" z="-552"/>
		</npc>
		
		<npc id="32192">
			<spawn heading="22896" x="-124064" y="51584" z="-552"/>
		</npc>
	</spawns>
</list>